Dimension,Resource Name,Description,URL,Phone
environmental,New Jersey Department of Environmental Protection (NJDEP),"NJDEP oversees environmental protection in New Jersey, providing resources on regulations, conservation programs, and public education initiatives.",https://www.nj.gov/dep,1-609-292-2885
environmental,New Jersey Audubon,"This organization is dedicated to the conservation of New Jersey's birds and their habitats, offering programs, resources, and volunteer opportunities.",https://njaudubon.org,1-908-204-8998
environmental,New Jersey Clean Communities Council,"This council promotes litter-free communities and environmental stewardship through education, outreach, and community service programs.",https://www.njcleancommunities.org,1-732-899-4919
environmental,New Jersey Conservation Foundation,"This nonprofit organization works to preserve New Jersey's natural resources through land conservation, advocacy, and community engagement.",https://www.njconservation.org,1-908-234-1225
environmental,Clean Water Action,"Clean Water Action is a national organization focused on clean water, climate change, and environmental justice, providing advocacy and community resources.",https://cleanwateraction.org,1-800-929-6081
environmental,New Jersey Future,"This organization promotes smart growth and sustainable development in New Jersey, offering resources for planning and community development.",https://www.njfuture.org,1-609-393-0008
environmental,American Rivers,"American Rivers focuses on protecting and restoring America's rivers, providing resources for river conservation, advocacy, and community engagement.",https://www.americanrivers.org,1-202-347-7550
environmental,National Resources Defense Council (NRDC),"NRDC is an environmental advocacy group that works to protect the earth's resources through policy development, litigation, and public engagement.",https://www.nrdc.org,1-212-727-2700
environmental,National Wildlife Federation (NWF),"NWF focuses on wildlife conservation and habitat restoration, providing educational resources and programs to engage communities in environmental stewardship.",https://www.nwf.org,1-800-822-9919
environmental,Project Drawdown,"Project Drawdown provides research and resources on climate solutions, focusing on practical strategies to reduce greenhouse gas emissions and promote sustainability.",https://www.drawdown.org,NaN
environmental,Recycling Partnership,"This organization works to improve recycling systems across the U.S. by providing resources, tools, and support for communities and businesses.",https://recyclingpartnership.org,1-703-299-8986
environmental,Keep America Beautiful,This nonprofit focuses on preventing litter and promoting environmental stewardship through community engagement and public education campaigns.,https://www.kab.org,1-800-822-4333
environmental,Green Seal,"Green Seal certifies products and services that meet strict environmental standards, helping consumers make eco-friendly choices.",https://www.greenseal.org,NaN
environmental,Climate Reality Project,"Founded by Al Gore, this organization focuses on climate change education and advocacy, providing resources for activists and community leaders.",https://www.climaterealityproject.org,1-202-742-0420
environmental,Energy Star,"Energy Star provides information on energy efficiency and sustainable practices for homes and businesses, helping consumers make informed choices.",https://www.energystar.gov,1-888-782-7937
environmental,Green Building Council,"This council promotes sustainable building practices through education, certification, and resources for architects, builders, and homeowners.",https://www.usgbc.org,1-202-552-1500
environmental,New Jersey Recycling Resource,"This resource provides information on recycling programs and guidelines specific to New Jersey, helping residents understand local recycling practices.",https://www.nj.gov/dep/recycle,1-609-292-9880
environmental,Sustainable Jersey,Sustainable Jersey is a certification program for municipalities in New Jersey that focuses on sustainability initiatives and community engagement.,https://www.sustainablejersey.com,1-609-771-2938
environmental,Clean Air Council,"This organization advocates for clean air and environmental protection, providing resources and support for community engagement and policy change.",https://cleanair.org,1-215-567-4004
environmental,New Jersey Environmental Federation,"The federation works to protect New Jersey's environment through advocacy, education, and community involvement, offering resources for activism.",https://www.njef.org,1-732-246-0012
environmental,EcoWatch,"EcoWatch is an online platform that provides news and resources on environmental issues, sustainability, and eco-friendly living.",https://www.ecowatch.com,NaN
environmental,The Green Program,"This program offers educational experiences focused on sustainability and environmental conservation, providing resources for students and young professionals.",https://www.thegreenprogram.com,NaN
environmental,Citizens Climate Lobby,"This nonprofit organization focuses on creating the political will for climate solutions, providing resources for advocacy and community engagement.",https://citizensclimatelobby.org,1-202-299-9408
environmental,1% for the Planet,"This organization encourages businesses and individuals to donate 1% of their sales to environmental nonprofits, providing a network for giving back to the planet.",https://www.onepercentfortheplanet.org,1-802-496-5408
environmental,EcoAction,"EcoAction funds community-based environmental projects across Canada and the U.S., providing resources and support for local initiatives.",https://www.ecoaction.gc.ca,NaN
environmental,National Environmental Education Foundation (NEEF),NEEF provides resources and programs for environmental education aimed at fostering a public understanding of environmental issues and solutions.,https://www.neefusa.org,1-202-833-2933
environmental,Just Transition Alliance,"This organization advocates for equitable transitions to sustainable practices, providing resources for community engagement, policy, and environmental justice.",https://www.justtransitionalliance.org,NaN
environmental,The Climate Reality Project,"Focused on climate change education and advocacy, this organization provides resources for individuals and communities working towards climate solutions.",https://www.climaterealityproject.org,1-202-742-0420
financial,National Endowment for Financial Education (NEFE)  ,"NEFE offers free financial education resources, including tools and information to help individuals improve their financial literacy.  ",https://www.nefe.org  ,NaN  
financial,MyMoney.gov  ,"A U.S. government website that provides information and tools for managing personal finances, including budgeting, saving, and investing.  ",https://www.mymoney.gov  ,NaN  
financial,Consumer Financial Protection Bureau (CFPB)  ,"The CFPB provides resources for consumers to understand financial products and services, including budgeting tools and financial education.  ",https://www.consumerfinance.gov  ,NaN  
financial,National Foundation for Credit Counseling (NFCC)  ,"NFCC offers financial counseling and education services, helping individuals manage their debts and improve financial health.  ",https://www.nfcc.org  ,1-800-388-2227  
financial,Smart About Money  ,"A free online resource that offers courses, tools, and resources to help individuals manage their money and plan for their financial future.  ",https://www.smartaboutmoney.com  ,NaN  
financial,Financial Literacy and Education Commission (FLEC)  ,FLEC coordinates federal efforts to improve financial literacy among American consumers through various educational resources.  ,https://www.treasurydirect.gov/indiv/tools/financialliteracy.htm  ,NaN  
financial,Jump$tart Coalition for Personal Financial Literacy  ,"A coalition of organizations that promote financial literacy for students and educators, providing resources and tools for effective financial education.  ",https://www.jumpstart.org  ,NaN  
financial,Credit Karma  ,"Credit Karma provides free credit scores and reports, along with personalized financial product recommendations and budgeting tools.  ",https://www.creditkarma.com  ,NaN  
financial,Mint  ,"A free budgeting app that helps users track spending, create budgets, and manage their finances in one place.  ",https://www.mint.com  ,NaN  
financial,USA.gov Financial Literacy  ,"A portal to various government resources related to financial literacy, including budgeting, saving, and fraud prevention.  ",https://www.usa.gov/financial-literacy  ,NaN  
financial,National Credit Union Administration (NCUA)  ,NCUA provides resources for consumers to understand credit unions and offers tips on managing finances and budgeting.  ,https://www.ncua.gov  ,NaN  
financial,Better Money Habits  ,A program by Bank of America that offers free online tools and resources to help individuals improve their financial habits and achieve their goals.  ,https://www.bettermoneyhabits.com  ,NaN  
financial,Council for Economic Education (CEE)  ,"CEE provides K-12 educators with resources to teach personal finance and economics, aiming to improve financial literacy in schools.  ",https://www.councilforeconed.org  ,NaN  
financial,Operation HOPE  ,"A nonprofit organization that provides financial literacy and economic empowerment programs, including credit counseling and money management workshops.  ",https://www.operationhope.org  ,1-888-388-4673  
financial,Financial Planning Association (FPA)  ,"FPA provides resources and tools for financial planning, including access to certified financial planners for personalized advice.  ",https://www.plannersearch.org  ,NaN  
financial,New Jersey Division of Consumer Affairs  ,"This state agency provides resources and information to help New Jersey residents understand consumer rights, including financial literacy resources.  ",https://www.njconsumeraffairs.gov  ,NaN  
financial,New Jersey Department of Banking and Insurance  ,"Offers resources for consumers about financial products, services, and financial literacy programs available to New Jersey residents.  ",https://www.nj.gov/dobi  ,NaN  
financial,Smart Money Management  ,"An online platform that provides tools and resources to help individuals manage their finances, including budgeting and debt management advice.  ",https://www.smartmoneymanagement.com  ,NaN  
financial,National Association of Personal Financial Advisors (NAPFA)  ,"NAPFA provides resources for finding fee-only financial advisors, as well as educational tools for improving financial literacy.  ",https://www.napfa.org  ,NaN  
financial,AARP Financial Education  ,"AARP offers financial education resources for older adults, focusing on retirement planning, budgeting, and managing expenses.  ",https://www.aarp.org/money/financial-literacy  ,NaN  
financial,211  ,"A free, confidential service that helps individuals find local resources for financial assistance and financial literacy programs.  ",https://www.211.org  ,211  
financial,Goodwill Financial Literacy  ,Goodwill offers financial literacy programs aimed at helping individuals achieve economic stability through budgeting and money management courses.  ,https://www.goodwill.org  ,NaN  
financial,The Mint  ,"A fun and educational website aimed at teaching kids and teens about money management, budgeting, and saving.  ",https://www.themint.org  ,NaN  
financial,Bankrate  ,"Provides comprehensive resources for financial decisions, including comparisons of financial products and advice on budgeting, saving, and investing.  ",https://www.bankrate.com  ,NaN  
financial,Practical Money Skills  ,"A financial literacy program created by Visa, offering free resources and tools for managing money, budgeting, and planning for the future.  ",https://www.practicalmoneyskills.com  ,NaN  
financial,Financial Fitness for Life  ,A program from the National Council on Economic Education that provides resources for teaching personal finance in K-12 settings.  ,https://www.fitnessforlife.org  ,NaN  
financial,Money Management International (MMI)  ,"MMI offers financial counseling, debt management, and education services to help individuals achieve financial stability.  ",https://www.moneymanagement.org  ,1-866-889-9347  
financial,New Jersey Financial Empowerment Consortium  ,A coalition dedicated to promoting financial literacy and empowerment for New Jersey residents through various programs and services.  ,https://www.nj.gov/dca/financial-empowerment/  ,NaN  
financial,The Financial Literacy Group  ,Offers online courses and resources to help individuals gain essential financial skills and knowledge for better money management.  ,https://www.financialliteracygroup.com  ,NaN  
financial,Clearpoint Credit Counseling Solutions  ,"A nonprofit organization providing credit counseling, budgeting help, and financial education to those in need.  ",https://www.clearpoint.org  ,1-800-750-2227  
financial,Smart Money  ,"Offers practical advice and tips on personal finance management, including budgeting, saving, and investing strategies.  ",https://www.smartmoney.com  ,NaN  
financial,New Jersey Credit Union League  ,Provides resources and educational programs aimed at improving financial literacy among New Jersey residents through credit unions.  ,https://www.njcul.org  ,NaN  
financial,The Financial Gym  ,Offers personal finance coaching and workshops to help individuals improve their financial habits and achieve their goals.  ,https://financialgym.com  ,NaN  
financial,The Balance  ,"A comprehensive personal finance website that provides articles, guides, and tools for budgeting, investing, and managing money.  ",https://www.thebalance.com  ,NaN  
financial,Nolo  ,"Nolo provides legal information and resources, including guides on financial topics such as debt collection and consumer rights.  ",https://www.nolo.com  ,NaN
