Dimension,Resource Name,Description,URL,Phone
emotional,National Alliance on Mental Illness (NAMI),"NAMI provides education, support, and advocacy for individuals affected by mental illness. They offer a helpline, local chapters, and programs for families and individuals.",https://www.nami.org,1-800-950-NAMI (6264)
emotional,Mental Health America (MHA),"MHA promotes mental health as a critical part of overall wellness. They provide resources for early identification and intervention, as well as screening tools.",https://www.mhanational.org,1-800-969-6642
emotional,Substance Abuse and Mental Health Services Administration (SAMHSA),"SAMHSA offers a treatment locator, a national helpline, and resources for mental health and substance use disorders.",https://www.samhsa.gov,1-800-662-HELP (4357)
emotional,Crisis Text Line,"A free, 24/7 text service that connects individuals in crisis with trained crisis counselors via text message.",https://www.crisistextline.org,NaN
emotional,BetterHelp,An online platform that connects individuals with licensed therapists for virtual counseling sessions.,https://www.betterhelp.com,NaN
emotional,Talkspace,"An online therapy platform offering counseling via text, audio, and video messaging with licensed therapists.",https://www.talkspace.com,NaN
emotional,7 Cups,A free online text chat service that provides emotional support and counseling with trained listeners and licensed therapists.,https://www.7cups.com,NaN
emotional,American Psychological Association (APA),"The APA offers resources on mental health education, research, and practice, including a locator for psychologists.",https://www.apa.org,NaN
emotional,National Suicide Prevention Lifeline,A nationwide network of crisis centers that provide 24/7 support for individuals in distress or crisis.,https://suicidepreventionlifeline.org,1-800-273-TALK (8255)
emotional,National Institute of Mental Health (NIMH),"NIMH provides information on mental disorders, research, and resources for individuals and families.",https://www.nimh.nih.gov,NaN
emotional,The Trevor Project,"A crisis intervention and suicide prevention organization for LGBTQ youth, offering 24/7 support and resources.",https://www.thetrevorproject.org,1-866-488-7386
emotional,Mental Health First Aid,A public education program that teaches people how to identify and respond to signs of mental illnesses and substance use disorders.,https://www.mentalhealthfirstaid.org,NaN
emotional,New Jersey Division of Mental Health and Addiction Services,"Provides information and resources for mental health and addiction services in New Jersey, including local treatment options.",https://www.nj.gov/humanservices/dmhas,1-800-382-6717
emotional,New Jersey Mental Health Cares,"A resource for New Jersey residents offering mental health services, support, and information about accessing care.",https://www.njmentalhealthcares.org,1-866-202-HELP (4357)
emotional,The Jed Foundation,A nonprofit organization focused on protecting emotional health and preventing suicide among teens and young adults through education and resources.,https://www.jedfoundation.org,NaN
emotional,Copeland Center for Wellness and Recovery,Offers training and resources for individuals with mental health challenges focusing on recovery and wellness.,https://copelandcenter.com,NaN
emotional,Support Groups Central,"An online platform offering a variety of support groups for mental health issues, including anxiety, depression, and more.",https://www.supportgroupscentral.com,NaN
emotional,Anxiety and Depression Association of America (ADAA),"Provides resources, information, and support for individuals dealing with anxiety and depression, including a therapist directory.",https://adaa.org,NaN
emotional,National Center for PTSD,"A resource for veterans and others affected by trauma, offering information, treatment options, and support resources.",https://www.ptsd.va.gov,NaN
emotional,The National Child Traumatic Stress Network,"Offers resources and support for children and families affected by trauma, including educational materials and treatment options.",https://www.nctsn.org,NaN
emotional,The Anxiety Network,"A resource providing information, articles, and support for individuals dealing with anxiety disorders.",https://www.anxietynetwork.com,NaN
emotional,The National Alliance for Grieving Children,"Offers resources and support for children and families grieving the loss of a loved one, including local support groups.",https://childrengrieve.org,NaN
emotional,The Recovery Village,"A resource for individuals seeking help for substance abuse and mental health issues, offering treatment options and support.",https://www.therecoveryvillage.com,NaN
emotional,The American Foundation for Suicide Prevention (AFSP),"Provides resources for suicide prevention, including educational materials, support groups, and local chapters.",https://afsp.org,NaN
emotional,The Center for Nonprofit Research,"Provides resources for finding mental health and emotional wellness nonprofits in your area, including information on services.",https://www.centerfornonprofitresearch.org,NaN
emotional,The National Mental Health Consumers' Self-Help Clearinghouse,A resource providing information about peer support and self-help resources for mental health consumers.,https://www.mhselfhelp.org,NaN
emotional,The National Council for Behavioral Health,Represents mental health and addiction treatment organizations and provides resources for improving mental health care.,https://www.thenationalcouncil.org,NaN
emotional,The Wellbeing Trust,A foundation focused on advancing mental health and wellness through community resources and advocacy.,https://wellbeingtrust.org,NaN
emotional,New Jersey Association of Mental Health and Addiction Agencies,Offers resources and advocacy for mental health and addiction service providers in New Jersey.,https://www.njamhaa.org,NaN
emotional,The National Association of School Psychologists (NASP),Provides resources and support for schools and families to promote emotional wellness and mental health in children and adolescents.,https://www.nasponline.org,NaN
emotional,The National Eating Disorders Association (NEDA),"Offers resources and support for individuals struggling with eating disorders, including a helpline and treatment locator.",https://www.nationaleatingdisorders.org,1-800-931-2237
emotional,The International Association for Trauma Professionals,"Provides resources, training, and certification for professionals working with trauma-affected individuals.",https://traumaprofessionals.com,NaN
emotional,The National Domestic Violence Hotline,"A resource for individuals affected by domestic violence, offering support, safety planning, and local resources.",https://www.thehotline.org,1-800-799-SAFE (7233)
emotional,The Child Mind Institute,"Provides resources for children's mental health, including articles, assessments, and treatment options for various disorders.",https://childmind.org,NaN
emotional,Psych Central,"An online resource offering articles, forums, and support for mental health issues, including a directory of therapists.",https://psychcentral.com,NaN
emotional,The GoodTherapy,"A directory of therapists and mental health professionals, along with educational resources and articles on emotional wellness.",https://www.goodtherapy.org,NaN
emotional,The National Alliance on Mental Illness New Jersey (NAMI NJ),"Provides support, education, and advocacy for individuals and families affected by mental health conditions in New Jersey.",https://www.naminj.org,1-800-368-6454
emotional,New Jersey Hope and Healing,"Offers emotional support and resources for individuals affected by disasters in New Jersey, focusing on recovery and resilience.",https://www.njhopeandhealing.org,1-877-294-HELP (4357)
emotional,The New Jersey Mental Health Association,"Provides advocacy, support, and education on mental health issues and community services in New Jersey.",https://www.njmentalhealthassociation.org,1-800-367-6274
emotional,The National Federation of Families for Children's Mental Health,"Focuses on family-driven support and advocacy for children with mental health challenges, offering resources and support networks.",https://ffcmh.org,NaN
emotional,The New Jersey Department of Human Services,"Provides a range of mental health services and resources for New Jersey residents, including crisis interventions and support.",https://www.nj.gov/humanservices,1-800-832-9173
physical,National Institute of Health (NIH),"NIH provides extensive information on various health topics, including physical wellness, fitness, nutrition, and disease prevention.",https://www.nih.gov,NaN
physical,Centers for Disease Control and Prevention (CDC),"The CDC offers resources on health and safety, including physical activity guidelines, nutrition, and disease prevention strategies.",https://www.cdc.gov,NaN
physical,ChooseMyPlate.gov,"This USDA site provides dietary guidelines, tools, and tips for healthy eating and physical activity for all age groups.",https://www.choosemyplate.gov,NaN
physical,American Heart Association,"The AHA offers resources on heart health, including physical activity recommendations, nutrition tips, and health education materials.",https://www.heart.org,NaN
physical,Fitness.gov,"A government site promoting physical activity with guidelines, resources, and tips for individuals and organizations to improve fitness.",https://www.fitness.gov,NaN
physical,National Fitness Campaign,Promotes active lifestyles through community fitness initiatives and provides resources for building outdoor fitness parks.,https://nationalfitnesscampaign.com,NaN
physical,YMCA,"The YMCA offers community-based fitness programs, classes, and resources for individuals and families to promote physical wellness.",https://www.ymca.net,NaN
physical,American Council on Exercise (ACE),ACE provides certification for fitness professionals and offers resources and educational materials on health and fitness.,https://www.acefitness.org,NaN
physical,National Institute on Aging (NIA),"NIA provides resources specifically for older adults, focusing on exercise, healthy eating, and maintaining physical wellness as we age.",https://www.nia.nih.gov,NaN
physical,Go4Life,A program from the NIA promoting exercise and physical activity as a way to stay healthy and active in older age.,https://go4life.nia.nih.gov,NaN
physical,Live Well New Jersey,"A state initiative offering resources and programs for health and wellness, including physical fitness opportunities across New Jersey.",https://www.nj.gov/health,NaN
physical,New Jersey Department of Health,"The NJ Department of Health provides resources about physical wellness, nutrition, and health initiatives specific to New Jersey residents.",https://www.nj.gov/health,NaN
physical,New Jersey YMCA State Alliance,"This organization supports YMCA programs in New Jersey, promoting health and wellness through fitness and community engagement.",https://www.njymca.org,NaN
physical,New Jersey Division of Aging Services,"Offers resources and programs for older adults in NJ, including information on physical fitness and wellness activities.",https://www.nj.gov/humanservices/doas,NaN
physical,Healthier New Jersey,"A campaign aimed at improving health outcomes in NJ, offering resources for healthy living, including fitness and nutrition.",https://www.nj.gov/health,NaN
physical,Shape Up NJ,A free program from the NJ Department of Health promoting physical activity and healthy eating through community-based initiatives.,https://www.nj.gov/health,NaN
physical,National Park Service (NPS),"Offers resources for outdoor physical activities such as hiking, biking, and more across national parks throughout the US.",https://www.nps.gov,NaN
physical,Let’s Move!,An initiative aimed at promoting physical activity and healthy eating for children and families across the nation.,https://letsmove.obamawhitehouse.archives.gov,NaN
physical,MyFitnessPal,"A mobile app and website that helps users track food intake and exercise, promoting overall physical wellness and healthy habits.",https://www.myfitnesspal.com,NaN
physical,Fitbit,"Provides fitness tracking devices and an app to monitor physical activity, sleep, and nutrition for better health management.",https://www.fitbit.com,NaN
physical,SparkPeople,"An online community offering fitness tracking, meal plans, and motivational resources for individuals seeking to improve their wellness.",https://www.sparkpeople.com,NaN
physical,Couch to 5K,A popular running program that helps beginners gradually increase their running ability to complete a 5K road race.,https://www.c25k.com,NaN
physical,Zocdoc,"An online service that helps users find healthcare providers and book appointments, including those related to physical wellness.",https://www.zocdoc.com,NaN
physical,Healthline,"Offers a wealth of articles, guides, and resources on health topics, including exercise, nutrition, and wellness tips.",https://www.healthline.com,NaN
physical,MedlinePlus,"A service of the National Library of Medicine providing resources on health topics, including physical wellness and exercise.",https://medlineplus.gov,NaN
physical,Verywell Fit,"Provides articles, tips, and resources on fitness, nutrition, and overall physical wellness for a healthy lifestyle.",https://www.verywellfit.com,NaN
physical,Online Fitness Programs (Beachbody),Offers a variety of online fitness programs and workouts to help individuals achieve their fitness goals from home.,https://www.beachbody.com,NaN
physical,AARP Fitness,Provides resources and information on fitness programs and activities tailored for older adults to maintain physical wellness.,https://www.aarp.org,NaN
physical,SparkPeople,"An online resource offering tools for tracking nutrition and exercise, along with community support for wellness.",https://www.sparkpeople.com,NaN
physical,The Mayo Clinic,"Offers a comprehensive resource on health topics, including physical wellness, exercise, and nutrition guidelines.",https://www.mayoclinic.org,NaN
physical,Exercise.com,"A platform that provides fitness coaching, workout plans, and resources for individuals looking to stay active.",https://www.exercise.com,NaN
physical,Planet Fitness,A chain of fitness centers offering affordable memberships and a variety of gym facilities across the US for physical wellness.,https://www.planetfitness.com,NaN
physical,OrangeTheory Fitness,A fitness studio chain offering high-intensity workout classes designed for all fitness levels to improve physical health.,https://www.orangetheory.com,NaN
physical,Anytime Fitness,"A 24-hour gym franchise with locations across the US, offering fitness facilities and classes for all levels.",https://www.anytimefitness.com,NaN
physical,Gold's Gym,A well-known fitness club offering a variety of training programs and classes aimed at improving physical wellness.,https://www.goldsgym.com,NaN
physical,The American College of Sports Medicine (ACSM),Provides resources and certifications for exercise professionals and offers guidelines on physical activity and health.,https://www.acsm.org,NaN
physical,Healthfinder,"A government website offering information on health topics, including physical wellness, nutrition, and preventive care.",https://healthfinder.gov,NaN
occupational,Occupational Safety and Health Administration (OSHA),OSHA provides guidelines and regulations to ensure safe and healthy working conditions for all employees across the U.S.,https://www.osha.gov,1-800-321-6742
occupational,National Institute for Occupational Safety and Health (NIOSH),NIOSH conducts research and makes recommendations to prevent work-related injury and illness.,https://www.cdc.gov/niosh,1-800-356-4674
occupational,Job Accommodation Network (JAN),"JAN offers free, expert, and confidential guidance on workplace accommodations and disability employment issues.",https://askjan.org,1-800-526-7234
occupational,Employee Assistance Program (EAP),"EAPs provide support for employees dealing with personal issues that may affect their work performance, including mental health and wellness resources.",https://www.eapassistance.com,NaN
occupational,The National Wellness Institute,The National Wellness Institute promotes the concept of holistic wellness in workplace culture through education and resources.,https://www.nationalwellness.org,NaN
occupational,American Psychological Association (APA) - Workplace,APA offers resources and articles that focus on mental health and psychological wellness in the workplace.,https://www.apa.org/topics/worker-wellbeing,NaN
occupational,New Jersey Department of Labor and Workforce Development,"This department provides resources for job seekers and employers, including workplace safety and health information in New Jersey.",https://www.nj.gov/labor,1-609-292-2305
occupational,New Jersey Division of Consumer Affairs,Offers resources for consumers and businesses regarding workplace rights and responsibilities.,https://www.njconsumeraffairs.gov,1-800-242-5846
occupational,Mental Health America,"Mental Health America provides resources and tools for individuals to improve mental health, including workplace wellness programs.",https://www.mhanational.org,NaN
occupational,WorkWell NYC,A program that promotes health and wellness for employees of New York City through various initiatives and resources.,https://www.nyc.gov/workwell,NaN
occupational,The American Heart Association - Workplace Health Solutions,This program provides resources and tools for organizations to create a culture of health in the workplace.,https://www.heart.org/en/healthy-living/healthy-lifestyle/workplace-health,NaN
occupational,Centers for Disease Control and Prevention (CDC) - Workplace Health,The CDC provides guidelines and resources for improving health in the workplace through various programs.,https://www.cdc.gov/niosh/topics/healthcare/default.html,NaN
occupational,Society for Human Resource Management (SHRM),SHRM offers resources and tools for HR professionals to promote workplace wellness and employee engagement.,https://www.shrm.org,1-800-283-7476
occupational,National Safety Council (NSC),NSC provides resources to help employers prevent workplace injuries and promote safety culture.,https://www.nsc.org,1-800-621-7619
occupational,New Jersey Worker's Compensation Division,This division provides resources and information on workers' compensation benefits and rights in New Jersey.,https://www.nj.gov/labor/wc,1-609-292-2515
occupational,The National Institute of Mental Health (NIMH),NIMH offers information and resources for mental health that can be applied in workplace settings.,https://www.nimh.nih.gov,1-866-615-6464
occupational,Healthy People 2030,"This initiative provides science-based, 10-year national objectives for improving the health of all Americans, including workplace wellness.",https://health.gov/healthypeople,NaN
occupational,National Alliance on Mental Illness (NAMI),"NAMI provides education, advocacy, and support for individuals and families affected by mental health issues, including workplace concerns.",https://www.nami.org,1-800-950-6264
occupational,The Wellness Council of America,This council helps businesses improve workplace wellness through programs and resources tailored to employee health.,https://www.wellnesscouncilofamerica.org,NaN
occupational,New Jersey Mental Health Services,"Provides information and resources on mental health services available to residents, including workplace-related issues.",https://www.nj.gov/humanservices/dmhs,1-800-382-6717
occupational,The Workplace Wellness Alliance,A coalition that provides resources and strategies for organizations to implement effective wellness programs.,https://www.workplacewellness.org,NaN
occupational,The American Diabetes Association - Workplace Wellness,Offers resources for employers to create a supportive environment for employees with diabetes and promote overall health.,https://www.diabetes.org/workplace,NaN
occupational,National Federation of Independent Business (NFIB),NFIB provides resources for small business owners to promote employee wellness and compliance with health regulations.,https://www.nfib.com,1-800-634-2669
occupational,New Jersey State Health Benefits Program,Provides health benefits and wellness programs for state employees and their families in New Jersey.,https://www.nj.gov/treasury/pensions/shbp.shtml,1-609-292-7524
occupational,Workplace Strategies for Mental Health,This initiative offers resources and tools for employers to improve mental health at work.,https://www.workplacestrategiesformentalhealth.com,NaN
occupational,The Employee Benefit Research Institute (EBRI),EBRI provides research and resources focused on employee benefits and workplace wellness initiatives.,https://www.ebri.org,NaN
occupational,National Wellness Association,"An organization that promotes wellness in the workplace through training, resources, and events.",https://www.nationalwellnessassociation.org,NaN
occupational,American Cancer Society - Workplace Solutions,Provides resources and support for employers to promote cancer awareness and prevention in the workplace.,https://www.cancer.org,NaN
occupational,New Jersey Society for Human Resource Management,Offers resources and networking opportunities for HR professionals in New Jersey to enhance workplace wellness initiatives.,https://www.njshrm.org,NaN
occupational,The Society for Occupational Health Psychology,Promotes research and practice in occupational health psychology to improve workplace health and well-being.,https://sohp-online.org,NaN
occupational,The National Center for Chronic Disease Prevention and Health Promotion,Provides guidelines and resources for promoting health and preventing chronic diseases in the workplace.,https://www.cdc.gov/chronicdisease,NaN
occupational,American Institute of Stress,This organization provides resources on stress management in the workplace to enhance employee wellness.,https://www.stress.org,NaN
occupational,New Jersey Division of Workplace Standards,"Offers information on workplace safety, rights, and resources for employees in New Jersey.",https://www.nj.gov/labor/wagehour,1-609-292-2272
occupational,The Work-Life Balance Institute,Provides research and resources to help organizations promote work-life balance for improved employee wellness.,https://worklifebalanceinstitute.org,NaN
occupational,The Center for Workplace Mental Health,Offers resources and guidance for employers to create a mentally healthy workplace environment.,https://www.workplacementalhealth.org,NaN
occupational,New Jersey Job Bank,A resource for job seekers that includes information on workplace wellness initiatives and job opportunities.,https://www.nj.gov/labor/careerservices/jobbank,NaN
occupational,The National Center for Safety and Health in Housing,Provides resources for improving health and safety within housing and workplace settings.,https://www.cdc.gov/nceh/lead,NaN
occupational,The American Association of Occupational Health Nurses,Offers resources and support for occupational health nurses to improve workplace safety and health.,https://www.aahonline.org,NaN
occupational,The Institute for Health and Productivity Management,Provides research and guidance on health and productivity management in the workplace to enhance wellness.,https://www.ihpm.org,NaN
occupational,The National Center for Occupational Health and Safety,Provides a range of resources focused on occupational health and safety practices.,https://www.cdc.gov/niosh,NaN
occupational,New Jersey Family Leave Insurance,Provides information on family leave insurance benefits to support employees' wellness and work-life balance.,https://www.nj.gov/labor/leave,NaN
occupational,The Center for Occupational Health and Safety,Offers resources and research focused on improving health and safety in various occupational settings.,https://www.cdc.gov/niosh,NaN
occupational,The National Safety Council - Workplace Safety,The NSC offers training and resources for organizations to promote safety and prevent workplace injuries.,https://www.nsc.org/workplace,NaN
occupational,The National Institute for Occupational Health and Safety,Provides resources and guidelines for promoting occupational health and safety across diverse industries.,https://www.cdc.gov/niosh,NaN
occupational,The Employee Ownership Foundation,Offers resources for businesses promoting employee ownership and engagement in workplace wellness.,https://employeeownershipfoundation.org,NaN
social,National Alliance on Mental Illness (NAMI),"NAMI provides support, education, and advocacy for individuals affected by mental health conditions, fostering social wellness through community engagement.",https://www.nami.org,1-800-950-NAMI (6264)
social,Mental Health America,"This organization offers resources and tools for mental health support, focusing on prevention and early intervention, which are crucial for social wellness.",https://www.mhanational.org,1-800-969-6642
social,Substance Abuse and Mental Health Services Administration (SAMHSA),"SAMHSA leads public health efforts to advance the behavioral health of the nation, providing resources for mental health and substance abuse recovery.",https://www.samhsa.gov,1-800-662-HELP (4357)
social,American Psychological Association (APA),"APA provides resources for psychological health, including social wellness resources, research, and guidelines for improving mental health.",https://www.apa.org,1-800-374-2721
social,National Institute of Mental Health (NIMH),"NIMH provides information on mental health disorders, research, and resources to promote understanding and treatment of mental health issues.",https://www.nimh.nih.gov,NaN
