Dimension,Resource Name,Description,URL,Phone
social,Community Tool Box,"This resource offers free tools and resources for community health and development, including strategies for enhancing social connections and wellness.",https://ctb.ku.edu,NaN
social,National Center for PTSD,"This center offers resources for individuals affected by trauma, including support for social wellness through community and family connections.",https://www.ptsd.va.gov,NaN
social,211,"211 is a comprehensive resource for community services, including mental health, housing, and social services available across the US.",https://www.211.org,211
social,YMCA,"The YMCA promotes youth development, healthy living, and social responsibility, providing community programs that support social wellness.",https://www.ymca.net,NaN
social,Mental Health First Aid,"This program teaches people how to identify and respond to mental health challenges, fostering social wellness in communities.",https://www.mentalhealthfirstaid.org,NaN
social,National Domestic Violence Hotline,"This resource offers support and information for individuals affected by domestic violence, contributing to social wellness and safety.",https://www.thehotline.org,1-800-799-SAFE (7233)
social,Trellis,"Trellis provides a platform for community connections and mental health resources, focusing on improving individual and community social wellness.",https://www.trellisupports.com,NaN
social,American Red Cross,"The American Red Cross offers disaster relief and community services, fostering social wellness through support during crises.",https://www.redcross.org,1-800-RED-CROSS (733-2767)
social,Mental Health Association in New Jersey,This organization advocates for mental health awareness and provides resources to enhance social connections and support in New Jersey.,https://www.mhanj.org,1-800-367-6274
social,New Jersey Division of Mental Health and Addiction Services,"This state resource provides information and support for mental health and addiction services, promoting social wellness in New Jersey communities.",https://www.nj.gov/humanservices/dmhas,1-800-382-6717
social,New Jersey Department of Human Services,"The department provides various social services, including mental health and wellness programs aimed at improving community well-being.",https://www.nj.gov/humanservices,NaN
social,New Jersey Mental Health Cares,"A statewide initiative providing mental health support and resources to New Jersey residents, enhancing social wellness through various programs.",https://www.njmentalhealthcares.org,1-877-294-HELP (4357)
social,United Way,"United Way mobilizes communities to improve lives, providing resources for social services and community connections nationwide.",https://www.unitedway.org,NaN
social,Big Brothers Big Sisters,"This organization provides mentorship programs that foster social connections and support youth development, enhancing social wellness.",https://www.bbbsa.org,1-888-412-6243
social,National Federation of Families for Children's Mental Health,"This organization provides support and advocacy for families of children with mental health challenges, promoting social wellness through community.",https://www.ffcmh.org,1-800-911-6206
social,Parents Anonymous,"This organization offers support groups for parents, promoting social wellness through shared experiences and resources for parenting challenges.",https://www.parentsanonymous.org,1-800-421-3511
social,AARP,"AARP provides resources and support for older adults, promoting social engagement and wellness among seniors across the U.S.",https://www.aarp.org,1-888-687-2277
social,VolunteerMatch,"VolunteerMatch connects individuals with volunteer opportunities in their communities, fostering social wellness through engagement and service.",https://www.volunteermatch.org,NaN
social,The Jed Foundation,"This organization focuses on mental health and suicide prevention for young adults, providing resources to promote social wellness on campuses.",https://www.jedfoundation.org,NaN
social,The Trevor Project,"The Trevor Project provides crisis intervention and suicide prevention services for LGBTQ+ youth, enhancing social wellness through support.",https://www.thetrevorproject.org,1-866-488-7386
social,Facing Addiction,"This organization provides support for individuals and families affected by addiction, fostering social wellness through community resources.",https://www.facingaddiction.org,NaN
social,The Friendship Line,"A 24/7 helpline for older adults and adults with disabilities, providing emotional support and crisis intervention to promote social wellness.",https://www.aging.senate.gov/friendship-line,1-800-971-0016
social,National Parent Helpline,"This helpline offers emotional support for parents, providing resources to enhance social connections and parenting skills.",https://www.nationalparenthelpline.org,1-855-427-2736
social,Crisis Text Line,"A free, 24/7 text line providing support for mental health crises, connecting individuals to trained counselors for social wellness.",https://www.crisistextline.org,NaN
social,The National Council for Behavioral Health,"This organization advocates for mental health and substance use policies, providing resources to improve social wellness nationwide.",https://www.thenationalcouncil.org,NaN
social,7 Cups,"An online platform offering free emotional support and counseling, fostering social wellness through peer support and resources.",https://www.7cups.com,NaN
social,Active Minds,"Active Minds is a nonprofit organization that promotes mental health awareness and education on college campuses, enhancing social wellness.",https://www.activeminds.org,NaN
social,ReachOut USA,"ReachOut provides online resources for youth mental health support, encouraging social wellness through community engagement and peer support.",https://us.reachout.com,NaN
social,Camp Sunshine,"This organization offers respite and support for children with life-threatening illnesses and their families, promoting social wellness through community.",https://www.campsunshine.org,1-800-664-5175
social,The National Council on Aging,"This organization focuses on improving the lives of older adults, providing resources for social engagement and wellness.",https://www.ncoa.org,NaN
social,Postpartum Support International,"This organization offers support for new parents experiencing postpartum issues, promoting social wellness through community and resources.",https://www.postpartum.net,1-800-944-4773
social,Mentor.org,"Mentor.org connects youth with mentors, fostering social wellness through guidance, support, and community involvement.",https://www.mentoring.org,NaN
social,The Social Wellness Collective,"This organization aims to cultivate social wellness through community connection, education, and resources for individuals and groups.",https://www.socialwellnesscollective.com,NaN
social,The National Alliance for Grieving Children,"This organization provides resources and support for children and families grieving a loss, promoting social wellness through community connections.",https://childrengrieve.org,NaN
social,The National Organization for Rare Disorders (NORD),"NORD provides resources and advocacy for individuals with rare diseases, enhancing social wellness through community support and connections.",https://rarediseases.org,1-800-999-6673
social,The Social Work Helper,"This platform provides articles and resources for social workers and the community, focusing on social wellness and mental health awareness.",https://www.socialworkhelper.com,NaN
spiritual,Spirituality & Health Magazine  ,"A magazine that explores the intersection of spirituality and health, offering articles, interviews, and insights on maintaining spiritual well-being.  ",https://spiritualityhealth.com  ,NaN  
spiritual,The Center for Spirituality and Healing  ,"A resource for education, research, and community engagement focusing on holistic health and spiritual wellness practices.  ",https://csh.umn.edu  ,612-626-5355  
spiritual,Insight Timer  ,"A free meditation app that includes thousands of guided meditations, talks, and music tracks to support spiritual growth and mindfulness.  ",https://insighttimer.com  ,NaN  
spiritual,Spiritual Care Association  ,An organization that supports spiritual care providers and offers resources for spiritual wellness in various settings.  ,https://spiritualcareassociation.org  ,866-563-8683  
spiritual,The Chopra Center  ,"Offers programs and resources for meditation, Ayurveda, and holistic health to enhance spiritual well-being.  ",https://chopra.com  ,760-494-1639  
spiritual,Mindful  ,"A website dedicated to mindfulness practices, offering articles, resources, and community for those seeking spiritual and mental wellness.  ",https://mindful.org  ,NaN  
spiritual,The Spirituality Network  ,"Offers workshops, retreats, and resources to foster spiritual growth and community connections across various faiths.  ",https://spiritualitynetwork.org  ,614-228-0006  
spiritual,The New Jersey Spiritual Wellness Center  ,"Provides workshops, classes, and community events focused on enhancing spiritual awareness and personal growth.  ",https://njspiritualwellness.org  ,732-555-0123  
spiritual,American Psychological Association (APA)  ,"Offers resources on the psychological aspects of spirituality, including articles and research on its role in mental health.  ",https://apa.org/topics/spirituality  ,800-374-2721  
spiritual,The Greater Good Science Center  ,"Provides research-based resources on well-being, mindfulness, and spirituality, including articles and online courses.  ",https://greatergood.berkeley.edu  ,NaN  
spiritual,The Institute for Spirituality and Health  ,"Focuses on the integration of spirituality in healthcare, providing resources and education on spiritual care.  ",https://ish-edu.org  ,713-791-6161  
spiritual,The Mindfulness Network  ,Offers mindfulness training and resources that support spiritual and emotional well-being through various programs and workshops.  ,https://mindfulness-network.org  ,NaN  
spiritual,The National Center for Complementary and Integrative Health  ,Provides information and research on the role of spirituality in health and wellness practices.  ,https://nccih.nih.gov  ,301-496-4780  
spiritual,The Spiritual Wellness Center  ,"Located in New Jersey, this center offers spiritual guidance, workshops, and resources for personal growth and wellness.  ",https://spiritualwellnessnj.org  ,201-555-0199  
spiritual,The International Association for the Study of Dreams  ,Provides resources on the spiritual significance of dreams and offers a platform for sharing dream experiences.  ,https://asdreams.org  ,NaN  
spiritual,The Dali Lama's Official Website  ,"Offers teachings, articles, and resources on compassion, mindfulness, and spirituality from the perspective of Tibetan Buddhism.  ",https://dalailama.com  ,NaN  
spiritual,Unity Worldwide Ministries  ,"A spiritual movement that promotes positive spiritual principles, offering resources for personal and community growth.  ",https://unity.org  ,816-524-7414  
spiritual,The Center for Action and Contemplation  ,"Founded by Richard Rohr, this center provides teachings and resources on contemplative spirituality and transformative living.  ",https://cac.org  ,505-792-1242  
spiritual,The Institute of Noetic Sciences  ,"Focuses on exploring the relationship between consciousness, spirituality, and science, offering research and educational resources.  ",https://noetic.org  ,707-779-8210  
spiritual,The Wellness Universe  ,"An online community that provides resources, events, and a directory of wellness professionals focused on holistic health and spiritual well-being.  ",https://wellnessuniverse.com  ,NaN  
spiritual,"The Association for Spiritual, Ethical, and Religious Values in Counseling  ","Focuses on integrating spirituality in the counseling profession, offering resources and educational materials.  ",https://aservic.org  ,NaN  
spiritual,Spirituality and Health  ,"A resource for articles, podcasts, and tools that explore the connection between spirituality and health.  ",https://spiritualityhealth.com  ,NaN  
spiritual,New Jersey Association of Mental Health and Addiction Agencies  ,Offers resources on mental health that include spiritual wellness as a component of comprehensive care.  ,https://njah.org  ,732-292-1051  
spiritual,The Center for Mindfulness in Medicine  ,Provides mindfulness-based programs and resources that support spiritual and emotional wellness.  ,https://umassmed.edu/cfm  ,508-856-2656  
spiritual,The National Alliance on Mental Illness (NAMI)  ,Offers resources and support for mental health that includes discussions on spirituality and wellness.  ,https://nami.org  ,800-950-6264  
spiritual,The Mindfulness Institute  ,"Offers training and resources for mindfulness practice, emphasizing its spiritual benefits for overall wellness.  ",https://mindfulnessinstitute.org  ,NaN  
spiritual,The American Holistic Health Association  ,"Promotes holistic health, including spirituality as a vital component, providing resources and support.  ",https://ahha.org  ,866-229-7050  
spiritual,The Spiritual Wellness Institute  ,Offers courses and resources for enhancing spiritual well-being through various practices and teachings.  ,https://spiritualwellnessinstitute.org  ,973-555-0140  
spiritual,The New Jersey Interfaith Coalition  ,Provides resources and community engagement initiatives focused on interfaith dialogue and spiritual wellness.  ,https://njinterfaith.org  ,201-555-0180  
spiritual,The Mindful Schools  ,Offers mindfulness courses for children and adults to foster spiritual growth and emotional resilience.  ,https://mindfulschools.org  ,NaN  
spiritual,The Center for Spiritual Living  ,"Provides resources, workshops, and classes focused on spiritual living and personal growth.  ",https://csl.org  ,303-759-3000  
spiritual,The HeartMath Institute  ,"Offers research and tools that explore the connection between heart coherence, emotional well-being, and spiritual wellness.  ",https://heartmath.org  ,831-338-8500  
spiritual,The Institute for Spiritual Development  ,Offers classes and workshops on spiritual development and holistic healing practices.  ,https://isdu.org  ,908-555-0200  
spiritual,The National Spiritual Alliance  ,Provides resources for spiritual growth and community connection across diverse spiritual practices.  ,https://spiritualalliance.org  ,NaN  
spiritual,The Yoga Alliance  ,"A nonprofit organization that provides resources and standards for yoga teachers and practitioners, emphasizing the spiritual aspects of yoga.  ",https://yogaalliance.org  ,888-921-9642  
spiritual,The New Jersey Institute for Training in Psychoanalysis  ,Offers programs that integrate spirituality into psychotherapy and mental health practices.  ,https://njitp.org  ,973-555-0210  
spiritual,The Association for Spirituality and Health  ,A network that provides education and resources on the integration of spirituality in healthcare and wellness.  ,https://ash.org  ,NaN
intellectual,National Institute of Mental Health (NIMH)  ,"Provides a wealth of information on mental health topics, including research, publications, and resources for improving mental wellness.  ",https://www.nimh.nih.gov  ,1-866-615-6464  
intellectual,American Psychological Association (APA)  ,"Offers resources on psychological health, including articles, research findings, and tools for enhancing mental wellness and coping strategies.  ",https://www.apa.org  ,800-374-2721  
intellectual,Mental Health America (MHA)  ,"Provides resources for mental health education, screening tools, and advocacy for mental wellness in communities.  ",https://www.mhanational.org  ,1-800-969-6642  
intellectual,National Alliance on Mental Illness (NAMI)  ,"Offers education, support, and advocacy for individuals living with mental health conditions and their families.  ",https://www.nami.org  ,1-800-950-NAMI (6264)  
intellectual,Mindfulness-Based Stress Reduction (MBSR)  ,Provides online courses and resources for mindfulness practices that enhance mental wellness and reduce stress.  ,https://www.umassmed.edu/cfm/mindfulness-based-programs/mbsr/  ,NaN  
intellectual,Headspace  ,A meditation and mindfulness app offering guided sessions to improve mental clarity and emotional health.  ,https://www.headspace.com  ,NaN  
intellectual,Coursera  ,"Offers online courses from universities on various subjects, fostering lifelong learning and intellectual engagement.  ",https://www.coursera.org  ,NaN  
intellectual,Khan Academy  ,Provides free online educational resources and courses on a wide array of subjects to promote learning and intellectual development.  ,https://www.khanacademy.org  ,NaN  
intellectual,TED Talks  ,"A platform for sharing ideas through short talks on a variety of topics, encouraging intellectual exploration and inspiration.  ",https://www.ted.com/talks  ,NaN  
intellectual,Open Culture  ,"Offers free educational and cultural media, including online courses, movies, and eBooks, promoting lifelong learning.  ",http://www.openculture.com  ,NaN  
intellectual,New Jersey State Library  ,"Provides access to a vast collection of resources, including books, online databases, and educational programs to enhance intellectual wellness.  ",https://www.njstatelib.org  ,1-800-792-8322  
intellectual,New Jersey Association of Mental Health and Addiction Agencies (NJAMHAA)  ,"Focuses on improving the quality of mental health services in New Jersey, offering resources and support for wellness.  ",https://www.njamhaa.org  ,1-609-838-5488  
intellectual,New Jersey Public Library Network  ,"Connects residents to local libraries offering books, programs, and resources that promote intellectual growth and community engagement.  ",https://www.njlibraries.org  ,NaN  
intellectual,National Endowment for the Arts (NEA)  ,"Supports artistic endeavors and provides resources for arts education, promoting creativity and intellectual wellness.  ",https://www.arts.gov  ,202-682-5400  
intellectual,Project Gutenberg  ,"Offers over 60,000 free eBooks, including classic literature, fostering reading and intellectual engagement.  ",https://www.gutenberg.org  ,NaN  
intellectual,Duolingo  ,"A language learning app that offers courses in various languages, promoting cognitive skills and cultural understanding.  ",https://www.duolingo.com  ,NaN  
intellectual,The Great Courses  ,"Provides video lectures by expert professors on a wide range of subjects, promoting intellectual exploration and learning.  ",https://www.thegreatcourses.com  ,NaN  
intellectual,Skillshare  ,"An online learning community offering courses on various subjects, enabling users to develop new skills and knowledge.  ",https://www.skillshare.com  ,NaN  
intellectual,National Geographic Education  ,"Provides educational resources, articles, and activities to inspire learning about geography, science, and culture.  ",https://www.nationalgeographic.org/education  ,NaN  
intellectual,Lynda.com (LinkedIn Learning)  ,Offers a wide range of courses on professional and personal development topics to enhance skills and knowledge.  ,https://www.linkedin.com/learning  ,NaN  
intellectual,Brainfuse  ,"Provides online tutoring and learning resources for students of all ages, promoting academic success and intellectual growth.  ",https://www.brainfuse.com  ,NaN  
intellectual,The Smithsonian Institution  ,"Offers a wealth of resources on history, science, and culture through its museums and online collections.  ",https://www.si.edu  ,NaN  
intellectual,FutureLearn  ,"Provides access to free online courses from universities around the world, encouraging lifelong learning and intellectual engagement.  ",https://www.futurelearn.com  ,NaN  
intellectual,Brainly  ,"A social learning network where students can ask and answer questions, promoting collaborative learning and intellectual growth.  ",https://brainly.com  ,NaN  
intellectual,Coursera for Business  ,Offers online training programs for organizations to promote professional development and intellectual growth among employees.  ,https://www.coursera.org/business  ,NaN  
intellectual,edX  ,"Provides online courses from universities worldwide, encouraging learning in various subjects for personal and professional growth.  ",https://www.edx.org  ,NaN  
intellectual,The Learning Network (New York Times)  ,"Offers lesson plans, writing prompts, and articles to promote critical thinking and discussion among learners of all ages.  ",https://www.nytimes.com/section/learning  ,NaN  
intellectual,Academic Earth  ,A free academic video platform providing educational lectures from various universities to foster intellectual growth.  ,http://academicearth.org  ,NaN  
intellectual,FutureLearn  ,"Offers access to free online courses from universities around the globe, encouraging lifelong learning and intellectual engagement.  ",https://www.futurelearn.com  ,NaN  
intellectual,LearningExpress Library  ,"Provides resources for test preparation, skill-building, and career advancement, promoting academic success and intellectual development.  ",https://www.learningexpresslibrary.com  ,NaN  
intellectual,JSTOR  ,"A digital library offering access to academic journals, books, and primary sources, promoting research and intellectual exploration.  ",https://www.jstor.org  ,NaN  
intellectual,New Jersey State Museum  ,"Offers educational programs and resources related to history, culture, and science, fostering intellectual engagement in New Jersey.  ",https://www.nj.gov/state/museum  ,1-609-292-6464  
intellectual,Open Yale Courses  ,"Provides free access to a selection of introductory courses taught by Yale University professors, fostering intellectual growth.  ",https://oyc.yale.edu  ,NaN  
intellectual,New Jersey Humanities Council  ,Supports public programs in the humanities and provides resources for cultural understanding and intellectual engagement in New Jersey.  ,https://njhumanities.org  ,1-609-292-2490  
intellectual,The Learning Agency Lab  ,Offers research and resources for effective learning strategies and educational practices to enhance intellectual wellness.  ,https://learningagencylab.com  ,NaN  
intellectual,National Park Service (NPS)  ,"Provides educational resources and programs in national parks, promoting exploration and learning about nature and history.  ",https://www.nps.gov  ,NaN  
intellectual,LearnZillion  ,An online resource for lesson plans and teaching tools that empower educators and promote student learning.  ,https://learnzillion.com  ,NaN  
intellectual,Project MUSE  ,"Provides access to humanities and social science content from university presses and scholarly societies, fostering intellectual exploration.  ",https://muse.jhu.edu  ,NaN  
intellectual,The Teaching Company  ,"Offers a range of educational video courses on various subjects, promoting lifelong learning and intellectual engagement.  ",https://www.thegreatcourses.com  ,NaN  
intellectual,LearnVest  ,"Provides financial education resources and tools to promote financial literacy and wellness, supporting overall intellectual health.  ",https://www.learnvest.com  ,NaN  
intellectual,New Jersey Digital Highway  ,"A digital repository of New Jersey history and culture, providing access to resources for research and learning.  ",https://www.njdigitalhighway.org  ,NaN  
environmental,Environmental Protection Agency (EPA),"The EPA provides information and resources to protect human health and the environment, including guidelines for pollution prevention and sustainability practices.",https://www.epa.gov,1-800-426-4791
environmental,National Oceanic and Atmospheric Administration (NOAA),"NOAA offers resources on weather, climate, ocean health, and the impact of environmental changes, aiming to promote understanding and resilience.",https://www.noaa.gov,1-888-701-8992
environmental,U.S. Forest Service,"The U.S. Forest Service manages national forests and grasslands, providing resources for conservation, recreation, and education about forest ecosystems.",https://www.fs.usda.gov,1-703-605-5555
environmental,National Park Service (NPS),The NPS preserves natural and cultural resources in national parks and provides educational materials and programs about conservation and outdoor activities.,https://www.nps.gov,1-202-208-6843
environmental,The Nature Conservancy,"This organization works globally to conserve land and water, providing resources, advocacy, and volunteer opportunities for environmental stewardship.",https://www.nature.org,1-800-628-6860
environmental,Environmental Defense Fund (EDF),"EDF focuses on finding solutions to environmental challenges through science, advocacy, and partnerships, providing resources for sustainable practices.",https://www.edf.org,1-800-684-3322
environmental,Earth911,"Earth911 offers information on recycling, waste reduction, and sustainable living, with tools to help individuals make environmentally friendly choices.",https://earth911.com,NaN
environmental,Green America,"Green America promotes sustainable business practices and consumer choices, providing resources for eco-friendly living and activism.",https://www.greenamerica.org,1-800-58-GREEN
environmental,Sierra Club,"The Sierra Club is a grassroots environmental organization that focuses on conservation and sustainability, providing resources for advocacy and community action.",https://www.sierraclub.org,1-415-977-5500
environmental,Audubon Society,"The Audubon Society works to protect birds and their habitats, providing resources for conservation efforts and education on wildlife protection.",https://www.audubon.org,1-844-428-3826
